{
  "project_id": "proj-1763811759",
  "project_name": "tanjiro",
  "requirements": "Basic To-Do List Website Requirements\r\nUser Interface:\r\n\r\nSimple input field to add new tasks quickly.\r\n\r\nList display area showing tasks clearly.\r\n\r\nCheckboxes or toggles to mark tasks as completed.\r\n\r\nEdit and delete options for existing tasks.\r\n\r\nResponsive design for use on both desktop and mobile devices.\r\n\r\nTask Management:\r\n\r\nAbility to add, edit, and delete tasks.\r\n\r\nMark tasks as complete or incomplete.\r\n\r\nOption to prioritize or categorize tasks.\r\n\r\nSave tasks persistently (local storage or backend database).\r\n\r\nUser Experience:\r\n\r\nClear visual differentiation between completed and pending tasks.\r\n\r\nEasy navigation and intuitive controls.\r\n\r\nOption to reorder tasks by drag and drop or priority.\r\n\r\nTechnical Requirements:\r\n\r\nResponsive front-end using HTML, CSS, and JavaScript.\r\n\r\nOptional backend for user authentication and task storage (using database).\r\n\r\nCross-browser compatibility.\r\n\r\nPerformance optimized for fast load and smooth interactions.",
  "status": "awaiting_review",
  "created_at": "2025-11-22T17:12:39.599562",
  "updated_at": "2025-11-22T17:12:39.599562",
  "steps": [],
  "steps_completed": [],
  "logs": [
    "LOG:Workflow started",
    "\ud83d\ude80 Started the Requirements Agent for tanjiro. I'll analyze your requirements and create a comprehensive document.",
    "STARTED:requirements",
    "LOG:Running requirements agent...",
    "Starting domain-aware requirements analysis",
    "Classifying project type and domain",
    "No context found for project tanjiro",
    "Creating initial context from requirements",
    "Researching best practices for general domain",
    "Researching: best practices general web_application development",
    "Researching: general software requirements standards",
    "Researching: web_application architecture patterns general",
    "Domain research completed: 0 results found",
    "Generating domain-specific requirements",
    "LOG:requirements agent finished successfully.",
    "\ud83d\udccb Requirements document generated: requirements.md. Please review in the file viewer.",
    "{'type': 'AWAITING_REVIEW', 'stage': 'requirements', 'files': ['requirements.md'], 'timestamp': '2025-11-22T17:13:03.022600'}",
    "Raw LLM response in call_llm (structured): functional_requirements=[FunctionalRequirement(id='FR-001', description='Users can add new tasks to their to-do list through a simple text input field.', priority='high', acceptance_criteria=[\"When a user types a task into the input field and presses 'Enter' or clicks an 'Add' button, the new task appears in the task list.\", 'The input field is cleared after a task is added.', 'Empty tasks cannot be added.']), FunctionalRequirement(id='FR-002', description='Display all current tasks in a list format.', priority='high', acceptance_criteria=['All added tasks are displayed in a clear, scrollable list.', 'Each task in the list shows its description.', 'The visual state (completed or pending) of each task is clearly indicated.']), FunctionalRequirement(id='FR-003', description='Users can mark a task as completed or reopen it.', priority='high', acceptance_criteria=['Each task has a checkbox or a similar control.', \"Clicking the checkbox toggles the task's status between 'completed' and 'pending'.\", 'Completed tasks are visually distinct from pending tasks (e.g., strikethrough text, different color).']), FunctionalRequirement(id='FR-004', description='Users can modify the description of an existing task.', priority='medium', acceptance_criteria=[\"Users can click an 'edit' icon or double-click a task to make its text editable.\", 'After editing, the user can save the changes, and the task list updates.']), FunctionalRequirement(id='FR-005', description='Users can remove a task from their to-do list.', priority='high', acceptance_criteria=[\"Each task has a 'delete' button or icon.\", 'Clicking the delete button permanently removes the task from the list after a confirmation.']), FunctionalRequirement(id='FR-006', description='Tasks persist even after the browser is closed and reopened.', priority='high', acceptance_criteria=[\"Tasks are saved to the browser's LocalStorage when added, edited, deleted, or reordered.\", 'When the user reloads or reopens the browser, their tasks are still present.']), FunctionalRequirement(id='FR-007', description='Allow users to reorder tasks to reflect their priority.', priority='low', acceptance_criteria=['Users can drag and drop tasks to change their order in the list.', 'The new order is saved and persists after a page reload.'])] non_functional_requirements=[NonFunctionalRequirement(category='Usability', description='The application must be responsive and work seamlessly on both desktop and mobile devices.', metrics=[\"Passes Google's Mobile-Friendly Test.\", 'All functionality is accessible and usable on screen widths from 320px to 1920px.']), NonFunctionalRequirement(category='Performance', description='The application should load quickly and provide a smooth user experience.', metrics=['Initial page load time under 2 seconds on a standard 3G connection.', 'UI updates (adding, deleting, editing tasks) should feel instantaneous (under 100ms).']), NonFunctionalRequirement(category='Compatibility', description='The application must function correctly on the latest versions of major web browsers.', metrics=['Full functionality on the latest two versions of Chrome, Firefox, Safari, and Edge.']), NonFunctionalRequirement(category='Accessibility', description='The application should be usable by people with disabilities.', metrics=['Compliance with WCAG 2.1 Level A standards.', 'Full keyboard navigation support.', 'Semantic HTML and ARIA attributes are used where appropriate.'])] complexity='low' estimated_timeline='20-25 hours' recommended_tech_stack=TechnologyStack(backend=['Node.js (Optional, for future enhancement)', 'Express.js (Optional, for future enhancement)'], frontend=['HTML5', 'CSS3', 'JavaScript (ES6+)'], database=['Browser LocalStorage (Primary)', 'SQLite (Optional, for future enhancement)'], devops=['Git', 'GitHub Pages / Netlify / Vercel (for deployment)']) project_structure=ProjectStructure(folders={'src': ['index.html', 'style.css', 'script.js'], 'games': ['tic-tac-toe.js'], 'assets': ['images/', 'icons/']}) risks=['Data Loss: Since data is stored in LocalStorage, users can accidentally clear their browser data, leading to the permanent loss of all tasks.', 'Scope Creep: Requests for features like user accounts, cloud sync, or task sharing would significantly increase complexity and require a backend, exceeding the initial timeline.', 'Browser Inconsistencies: Minor differences in CSS or JavaScript implementation across browsers may require specific fixes.'] assumptions=['The initial version will use browser LocalStorage for data persistence, eliminating the need for a backend database and user authentication.', 'The design will be minimalist and functional, focusing on core features rather than complex UI/UX elements.', 'User authentication and multi-user support are out of scope for this version.', 'The application is intended for personal use, so there are no collaboration or data-sharing features.']",
    "Raw LLM response (structured): functional_requirements=[FunctionalRequirement(id='FR-001', description='Users can add new tasks to their to-do list through a simple text input field.', priority='high', acceptance_criteria=[\"When a user types a task into the input field and presses 'Enter' or clicks an 'Add' button, the new task appears in the task list.\", 'The input field is cleared after a task is added.', 'Empty tasks cannot be added.']), FunctionalRequirement(id='FR-002', description='Display all current tasks in a list format.', priority='high', acceptance_criteria=['All added tasks are displayed in a clear, scrollable list.', 'Each task in the list shows its description.', 'The visual state (completed or pending) of each task is clearly indicated.']), FunctionalRequirement(id='FR-003', description='Users can mark a task as completed or reopen it.', priority='high', acceptance_criteria=['Each task has a checkbox or a similar control.', \"Clicking the checkbox toggles the task's status between 'completed' and 'pending'.\", 'Completed tasks are visually distinct from pending tasks (e.g., strikethrough text, different color).']), FunctionalRequirement(id='FR-004', description='Users can modify the description of an existing task.', priority='medium', acceptance_criteria=[\"Users can click an 'edit' icon or double-click a task to make its text editable.\", 'After editing, the user can save the changes, and the task list updates.']), FunctionalRequirement(id='FR-005', description='Users can remove a task from their to-do list.', priority='high', acceptance_criteria=[\"Each task has a 'delete' button or icon.\", 'Clicking the delete button permanently removes the task from the list after a confirmation.']), FunctionalRequirement(id='FR-006', description='Tasks persist even after the browser is closed and reopened.', priority='high', acceptance_criteria=[\"Tasks are saved to the browser's LocalStorage when added, edited, deleted, or reordered.\", 'When the user reloads or reopens the browser, their tasks are still present.']), FunctionalRequirement(id='FR-007', description='Allow users to reorder tasks to reflect their priority.', priority='low', acceptance_criteria=['Users can drag and drop tasks to change their order in the list.', 'The new order is saved and persists after a page reload.'])] non_functional_requirements=[NonFunctionalRequirement(category='Usability', description='The application must be responsive and work seamlessly on both desktop and mobile devices.', metrics=[\"Passes Google's Mobile-Friendly Test.\", 'All functionality is accessible and usable on screen widths from 320px to 1920px.']), NonFunctionalRequirement(category='Performance', description='The application should load quickly and provide a smooth user experience.', metrics=['Initial page load time under 2 seconds on a standard 3G connection.', 'UI updates (adding, deleting, editing tasks) should feel instantaneous (under 100ms).']), NonFunctionalRequirement(category='Compatibility', description='The application must function correctly on the latest versions of major web browsers.', metrics=['Full functionality on the latest two versions of Chrome, Firefox, Safari, and Edge.']), NonFunctionalRequirement(category='Accessibility', description='The application should be usable by people with disabilities.', metrics=['Compliance with WCAG 2.1 Level A standards.', 'Full keyboard navigation support.', 'Semantic HTML and ARIA attributes are used where appropriate.'])] complexity='low' estimated_timeline='20-25 hours' recommended_tech_stack=TechnologyStack(backend=['Node.js (Optional, for future enhancement)', 'Express.js (Optional, for future enhancement)'], frontend=['HTML5', 'CSS3', 'JavaScript (ES6+)'], database=['Browser LocalStorage (Primary)', 'SQLite (Optional, for future enhancement)'], devops=['Git', 'GitHub Pages / Netlify / Vercel (for deployment)']) project_structure=ProjectStructure(folders={'src': ['index.html', 'style.css', 'script.js'], 'games': ['tic-tac-toe.js'], 'assets': ['images/', 'icons/']}) risks=['Data Loss: Since data is stored in LocalStorage, users can accidentally clear their browser data, leading to the permanent loss of all tasks.', 'Scope Creep: Requests for features like user accounts, cloud sync, or task sharing would significantly increase complexity and require a backend, exceeding the initial timeline.', 'Browser Inconsistencies: Minor differences in CSS or JavaScript implementation across browsers may require specific fixes.'] assumptions=['The initial version will use browser LocalStorage for data persistence, eliminating the need for a backend database and user authentication.', 'The design will be minimalist and functional, focusing on core features rather than complex UI/UX elements.', 'User authentication and multi-user support are out of scope for this version.', 'The application is intended for personal use, so there are no collaboration or data-sharing features.']"
  ],
  "files": [],
  "generated_files": [],
  "current_step": null,
  "completed": false,
  "enable_github": false,
  "github_username": "",
  "github_token": "",
  "generate_tests": true,
  "generate_devops": true,
  "last_saved": "2025-11-22T17:13:03.028764+05:30",
  "state": {
    "project_id": "proj-1763811759",
    "project_name": "tanjiro",
    "requirements": "Basic To-Do List Website Requirements\r\nUser Interface:\r\n\r\nSimple input field to add new tasks quickly.\r\n\r\nList display area showing tasks clearly.\r\n\r\nCheckboxes or toggles to mark tasks as completed.\r\n\r\nEdit and delete options for existing tasks.\r\n\r\nResponsive design for use on both desktop and mobile devices.\r\n\r\nTask Management:\r\n\r\nAbility to add, edit, and delete tasks.\r\n\r\nMark tasks as complete or incomplete.\r\n\r\nOption to prioritize or categorize tasks.\r\n\r\nSave tasks persistently (local storage or backend database).\r\n\r\nUser Experience:\r\n\r\nClear visual differentiation between completed and pending tasks.\r\n\r\nEasy navigation and intuitive controls.\r\n\r\nOption to reorder tasks by drag and drop or priority.\r\n\r\nTechnical Requirements:\r\n\r\nResponsive front-end using HTML, CSS, and JavaScript.\r\n\r\nOptional backend for user authentication and task storage (using database).\r\n\r\nCross-browser compatibility.\r\n\r\nPerformance optimized for fast load and smooth interactions.",
    "status": "awaiting_review",
    "created_at": "2025-11-22T17:12:39.599562",
    "updated_at": "2025-11-22T17:12:39.599562",
    "steps": [],
    "steps_completed": [
      "requirements"
    ],
    "logs": [
      "LOG:Workflow started"
    ],
    "files": [],
    "generated_files": [],
    "current_step": "requirements",
    "completed": false,
    "enable_github": false,
    "github_username": "",
    "github_token": "",
    "generate_tests": true,
    "generate_devops": true,
    "last_saved": "2025-11-22T17:12:39.645160+05:30",
    "checkpoint_data": {
      "stage": "requirements",
      "analysis": {
        "functional_requirements": [
          {
            "id": "FR-001",
            "description": "Users can add new tasks to their to-do list through a simple text input field.",
            "priority": "high",
            "acceptance_criteria": [
              "When a user types a task into the input field and presses 'Enter' or clicks an 'Add' button, the new task appears in the task list.",
              "The input field is cleared after a task is added.",
              "Empty tasks cannot be added."
            ]
          },
          {
            "id": "FR-002",
            "description": "Display all current tasks in a list format.",
            "priority": "high",
            "acceptance_criteria": [
              "All added tasks are displayed in a clear, scrollable list.",
              "Each task in the list shows its description.",
              "The visual state (completed or pending) of each task is clearly indicated."
            ]
          },
          {
            "id": "FR-003",
            "description": "Users can mark a task as completed or reopen it.",
            "priority": "high",
            "acceptance_criteria": [
              "Each task has a checkbox or a similar control.",
              "Clicking the checkbox toggles the task's status between 'completed' and 'pending'.",
              "Completed tasks are visually distinct from pending tasks (e.g., strikethrough text, different color)."
            ]
          },
          {
            "id": "FR-004",
            "description": "Users can modify the description of an existing task.",
            "priority": "medium",
            "acceptance_criteria": [
              "Users can click an 'edit' icon or double-click a task to make its text editable.",
              "After editing, the user can save the changes, and the task list updates."
            ]
          },
          {
            "id": "FR-005",
            "description": "Users can remove a task from their to-do list.",
            "priority": "high",
            "acceptance_criteria": [
              "Each task has a 'delete' button or icon.",
              "Clicking the delete button permanently removes the task from the list after a confirmation."
            ]
          },
          {
            "id": "FR-006",
            "description": "Tasks persist even after the browser is closed and reopened.",
            "priority": "high",
            "acceptance_criteria": [
              "Tasks are saved to the browser's LocalStorage when added, edited, deleted, or reordered.",
              "When the user reloads or reopens the browser, their tasks are still present."
            ]
          },
          {
            "id": "FR-007",
            "description": "Allow users to reorder tasks to reflect their priority.",
            "priority": "low",
            "acceptance_criteria": [
              "Users can drag and drop tasks to change their order in the list.",
              "The new order is saved and persists after a page reload."
            ]
          }
        ],
        "non_functional_requirements": [
          {
            "category": "Usability",
            "description": "The application must be responsive and work seamlessly on both desktop and mobile devices.",
            "metrics": [
              "Passes Google's Mobile-Friendly Test.",
              "All functionality is accessible and usable on screen widths from 320px to 1920px."
            ]
          },
          {
            "category": "Performance",
            "description": "The application should load quickly and provide a smooth user experience.",
            "metrics": [
              "Initial page load time under 2 seconds on a standard 3G connection.",
              "UI updates (adding, deleting, editing tasks) should feel instantaneous (under 100ms)."
            ]
          },
          {
            "category": "Compatibility",
            "description": "The application must function correctly on the latest versions of major web browsers.",
            "metrics": [
              "Full functionality on the latest two versions of Chrome, Firefox, Safari, and Edge."
            ]
          },
          {
            "category": "Accessibility",
            "description": "The application should be usable by people with disabilities.",
            "metrics": [
              "Compliance with WCAG 2.1 Level A standards.",
              "Full keyboard navigation support.",
              "Semantic HTML and ARIA attributes are used where appropriate."
            ]
          }
        ],
        "complexity": "low",
        "estimated_timeline": "20-25 hours",
        "recommended_tech_stack": {
          "backend": [
            "Node.js (Optional, for future enhancement)",
            "Express.js (Optional, for future enhancement)"
          ],
          "frontend": [
            "HTML5",
            "CSS3",
            "JavaScript (ES6+)"
          ],
          "database": [
            "Browser LocalStorage (Primary)",
            "SQLite (Optional, for future enhancement)"
          ],
          "devops": [
            "Git",
            "GitHub Pages / Netlify / Vercel (for deployment)"
          ]
        },
        "project_structure": {
          "folders": {
            "src": [
              "index.html",
              "style.css",
              "script.js"
            ],
            "games": [
              "tic-tac-toe.js"
            ],
            "assets": [
              "images/",
              "icons/"
            ]
          }
        },
        "risks": [
          "Data Loss: Since data is stored in LocalStorage, users can accidentally clear their browser data, leading to the permanent loss of all tasks.",
          "Scope Creep: Requests for features like user accounts, cloud sync, or task sharing would significantly increase complexity and require a backend, exceeding the initial timeline.",
          "Browser Inconsistencies: Minor differences in CSS or JavaScript implementation across browsers may require specific fixes."
        ],
        "assumptions": [
          "The initial version will use browser LocalStorage for data persistence, eliminating the need for a backend database and user authentication.",
          "The design will be minimalist and functional, focusing on core features rather than complex UI/UX elements.",
          "User authentication and multi-user support are out of scope for this version.",
          "The application is intended for personal use, so there are no collaboration or data-sharing features."
        ]
      },
      "requires_modification": false,
      "modification_comments": []
    },
    "awaiting_review": true,
    "message": "Requirements analysis complete. Awaiting human review."
  }
}