{
  "project_id": "proj-1763804311",
  "project_name": "tokomo",
  "requirements": "Basic To-Do List Website Requirements\r\nUser Interface:\r\n\r\nSimple input field to add new tasks quickly.\r\n\r\nList display area showing tasks clearly.\r\n\r\nCheckboxes or toggles to mark tasks as completed.\r\n\r\nEdit and delete options for existing tasks.\r\n\r\nResponsive design for use on both desktop and mobile devices.\r\n\r\nTask Management:\r\n\r\nAbility to add, edit, and delete tasks.\r\n\r\nMark tasks as complete or incomplete.\r\n\r\nOption to prioritize or categorize tasks.\r\n\r\nSave tasks persistently (local storage or backend database).\r\n\r\nUser Experience:\r\n\r\nClear visual differentiation between completed and pending tasks.\r\n\r\nEasy navigation and intuitive controls.\r\n\r\nOption to reorder tasks by drag and drop or priority.\r\n\r\nTechnical Requirements:\r\n\r\nResponsive front-end using HTML, CSS, and JavaScript.\r\n\r\nOptional backend for user authentication and task storage (using database).\r\n\r\nCross-browser compatibility.\r\n\r\nPerformance optimized for fast load and smooth interactions.",
  "status": "awaiting_review",
  "created_at": "2025-11-22T15:08:31.363742",
  "updated_at": "2025-11-22T15:08:31.363742",
  "steps": [],
  "logs": [
    "LOG:Workflow started",
    "STARTED:requirements",
    "LOG:Running requirements agent...",
    "Starting domain-aware requirements analysis",
    "Classifying project type and domain",
    "No context found for project tokomo",
    "Creating initial context from requirements",
    "Researching best practices for general domain",
    "Researching: best practices general web_application development",
    "Researching: general software requirements standards",
    "Researching: web_application architecture patterns general",
    "Domain research completed: 0 results found",
    "Generating domain-specific requirements",
    "LOG:requirements agent finished successfully.",
    "PAUSED:requirements",
    "Raw LLM response in call_llm (structured): functional_requirements=[FunctionalRequirement(id='FR-001', description='Allows a user to add a new task to their to-do list.', priority='high', acceptance_criteria=['An input field is displayed at the top of the page.', 'User can type a task description into the input field.', \"Pressing 'Enter' or clicking an 'Add' button adds the task to the list.\", 'The input field is cleared after adding a task.']), FunctionalRequirement(id='FR-002', description='Allows a user to mark a task as complete or incomplete.', priority='high', acceptance_criteria=['A checkbox or similar control is visible next to each task.', \"Clicking the checkbox toggles the task's completion status.\", 'Completed tasks are visually distinct from pending tasks (e.g., strikethrough text, faded color).']), FunctionalRequirement(id='FR-003', description='Allows a user to modify the description of an existing task.', priority='medium', acceptance_criteria=[\"An 'Edit' button or icon is available for each task.\", \"Clicking 'Edit' allows the user to modify the task's description in-place.\", 'Saving the changes updates the task in the list.']), FunctionalRequirement(id='FR-004', description='Allows a user to remove a task from the list.', priority='high', acceptance_criteria=[\"A 'Delete' button or icon is available for each task.\", \"Clicking 'Delete' prompts the user for confirmation.\", 'Upon confirmation, the task is permanently removed from the list.']), FunctionalRequirement(id='FR-005', description=\"Ensures that the user's tasks are saved between sessions.\", priority='high', acceptance_criteria=['Tasks added, edited, deleted, or marked as complete persist after the browser is closed and reopened.', 'The application uses browser local storage to save task data.']), FunctionalRequirement(id='FR-006', description='The user interface must be fully responsive and adapt to various device viewports.', priority='medium', acceptance_criteria=['The application layout adjusts cleanly for mobile, tablet, and desktop screen sizes.', 'All functionality is accessible and usable on all supported screen sizes.'])] non_functional_requirements=[NonFunctionalRequirement(category='Performance', description='The web application should load quickly and provide a smooth user experience without noticeable delays in interactions.', metrics=['Initial page load time under 2 seconds.', 'UI response to user actions (add, complete, delete) under 100ms.']), NonFunctionalRequirement(category='Usability', description='The interface must be intuitive and easy to use for a general audience with minimal to no instruction.', metrics=['A new user can successfully add and complete a task within 30 seconds.', 'Controls for adding, editing, and deleting tasks are clearly visible and understandable.']), NonFunctionalRequirement(category='Compatibility', description='The application must render and function correctly across the latest versions of major web browsers.', metrics=['Full support for the latest two versions of Google Chrome, Mozilla Firefox, Apple Safari, and Microsoft Edge.']), NonFunctionalRequirement(category='Accessibility', description='The application should be usable by people with disabilities, following web accessibility standards.', metrics=['WCAG 2.1 Level AA compliance.', 'Full keyboard navigation support.', 'Screen reader compatibility.'])] complexity='low' estimated_timeline='20-30 hours' recommended_tech_stack=TechnologyStack(backend=['None (for local storage version)', 'Node.js with Express (for optional database version)'], frontend=['HTML5', 'CSS3', 'JavaScript (ES6+)'], database=['Browser Local Storage', 'PostgreSQL or MongoDB (for optional database version)'], devops=['Git (Version Control)', 'GitHub Pages or Netlify (for static hosting)']) project_structure=ProjectStructure(folders={'src': ['index.html', 'style.css', 'script.js'], 'games': ['tic-tac-toe.js'], 'assets': ['images/', 'icons/']}) risks=['Data Loss: Since data is stored in local storage, users can lose their data if they clear their browser cache or switch devices.', 'Scope Creep: Requests for additional features like user accounts, due dates, or categories could expand the project beyond its initial low-complexity scope and timeline.', 'Browser Inconsistencies: Minor differences in JavaScript or CSS implementation across browsers may require specific fixes.'] assumptions=[\"The initial version will not require user authentication. All data will be stored in the browser's local storage.\", 'The application will manage a single to-do list, not multiple lists per user.', 'The target users will be using modern, up-to-date web browsers that support HTML5, CSS3, and ES6 JavaScript.', 'The scope is limited to the core features of a to-do list; advanced features like reminders, attachments, or collaboration are out of scope.']",
    "Raw LLM response (structured): functional_requirements=[FunctionalRequirement(id='FR-001', description='Allows a user to add a new task to their to-do list.', priority='high', acceptance_criteria=['An input field is displayed at the top of the page.', 'User can type a task description into the input field.', \"Pressing 'Enter' or clicking an 'Add' button adds the task to the list.\", 'The input field is cleared after adding a task.']), FunctionalRequirement(id='FR-002', description='Allows a user to mark a task as complete or incomplete.', priority='high', acceptance_criteria=['A checkbox or similar control is visible next to each task.', \"Clicking the checkbox toggles the task's completion status.\", 'Completed tasks are visually distinct from pending tasks (e.g., strikethrough text, faded color).']), FunctionalRequirement(id='FR-003', description='Allows a user to modify the description of an existing task.', priority='medium', acceptance_criteria=[\"An 'Edit' button or icon is available for each task.\", \"Clicking 'Edit' allows the user to modify the task's description in-place.\", 'Saving the changes updates the task in the list.']), FunctionalRequirement(id='FR-004', description='Allows a user to remove a task from the list.', priority='high', acceptance_criteria=[\"A 'Delete' button or icon is available for each task.\", \"Clicking 'Delete' prompts the user for confirmation.\", 'Upon confirmation, the task is permanently removed from the list.']), FunctionalRequirement(id='FR-005', description=\"Ensures that the user's tasks are saved between sessions.\", priority='high', acceptance_criteria=['Tasks added, edited, deleted, or marked as complete persist after the browser is closed and reopened.', 'The application uses browser local storage to save task data.']), FunctionalRequirement(id='FR-006', description='The user interface must be fully responsive and adapt to various device viewports.', priority='medium', acceptance_criteria=['The application layout adjusts cleanly for mobile, tablet, and desktop screen sizes.', 'All functionality is accessible and usable on all supported screen sizes.'])] non_functional_requirements=[NonFunctionalRequirement(category='Performance', description='The web application should load quickly and provide a smooth user experience without noticeable delays in interactions.', metrics=['Initial page load time under 2 seconds.', 'UI response to user actions (add, complete, delete) under 100ms.']), NonFunctionalRequirement(category='Usability', description='The interface must be intuitive and easy to use for a general audience with minimal to no instruction.', metrics=['A new user can successfully add and complete a task within 30 seconds.', 'Controls for adding, editing, and deleting tasks are clearly visible and understandable.']), NonFunctionalRequirement(category='Compatibility', description='The application must render and function correctly across the latest versions of major web browsers.', metrics=['Full support for the latest two versions of Google Chrome, Mozilla Firefox, Apple Safari, and Microsoft Edge.']), NonFunctionalRequirement(category='Accessibility', description='The application should be usable by people with disabilities, following web accessibility standards.', metrics=['WCAG 2.1 Level AA compliance.', 'Full keyboard navigation support.', 'Screen reader compatibility.'])] complexity='low' estimated_timeline='20-30 hours' recommended_tech_stack=TechnologyStack(backend=['None (for local storage version)', 'Node.js with Express (for optional database version)'], frontend=['HTML5', 'CSS3', 'JavaScript (ES6+)'], database=['Browser Local Storage', 'PostgreSQL or MongoDB (for optional database version)'], devops=['Git (Version Control)', 'GitHub Pages or Netlify (for static hosting)']) project_structure=ProjectStructure(folders={'src': ['index.html', 'style.css', 'script.js'], 'games': ['tic-tac-toe.js'], 'assets': ['images/', 'icons/']}) risks=['Data Loss: Since data is stored in local storage, users can lose their data if they clear their browser cache or switch devices.', 'Scope Creep: Requests for additional features like user accounts, due dates, or categories could expand the project beyond its initial low-complexity scope and timeline.', 'Browser Inconsistencies: Minor differences in JavaScript or CSS implementation across browsers may require specific fixes.'] assumptions=[\"The initial version will not require user authentication. All data will be stored in the browser's local storage.\", 'The application will manage a single to-do list, not multiple lists per user.', 'The target users will be using modern, up-to-date web browsers that support HTML5, CSS3, and ES6 JavaScript.', 'The scope is limited to the core features of a to-do list; advanced features like reminders, attachments, or collaboration are out of scope.']"
  ],
  "files": [],
  "current_step": null,
  "completed": false,
  "enable_github": false,
  "github_username": "",
  "github_token": "",
  "generate_tests": true,
  "generate_devops": true,
  "last_saved": "2025-11-22T15:09:23.695648+05:30",
  "state": {
    "project_id": "proj-1763804311",
    "project_name": "tokomo",
    "requirements": "Basic To-Do List Website Requirements\r\nUser Interface:\r\n\r\nSimple input field to add new tasks quickly.\r\n\r\nList display area showing tasks clearly.\r\n\r\nCheckboxes or toggles to mark tasks as completed.\r\n\r\nEdit and delete options for existing tasks.\r\n\r\nResponsive design for use on both desktop and mobile devices.\r\n\r\nTask Management:\r\n\r\nAbility to add, edit, and delete tasks.\r\n\r\nMark tasks as complete or incomplete.\r\n\r\nOption to prioritize or categorize tasks.\r\n\r\nSave tasks persistently (local storage or backend database).\r\n\r\nUser Experience:\r\n\r\nClear visual differentiation between completed and pending tasks.\r\n\r\nEasy navigation and intuitive controls.\r\n\r\nOption to reorder tasks by drag and drop or priority.\r\n\r\nTechnical Requirements:\r\n\r\nResponsive front-end using HTML, CSS, and JavaScript.\r\n\r\nOptional backend for user authentication and task storage (using database).\r\n\r\nCross-browser compatibility.\r\n\r\nPerformance optimized for fast load and smooth interactions.",
    "status": "awaiting_review",
    "created_at": "2025-11-22T15:08:31.363742",
    "updated_at": "2025-11-22T15:08:31.363742",
    "steps": [],
    "logs": [
      "LOG:Workflow started"
    ],
    "files": [],
    "current_step": "requirements",
    "completed": false,
    "enable_github": false,
    "github_username": "",
    "github_token": "",
    "generate_tests": true,
    "generate_devops": true,
    "last_saved": "2025-11-22T15:08:56.222572+05:30",
    "checkpoint_data": {
      "stage": "requirements",
      "analysis": {
        "functional_requirements": [
          {
            "id": "FR-001",
            "description": "Allows a user to add a new task to their to-do list.",
            "priority": "high",
            "acceptance_criteria": [
              "An input field is displayed at the top of the page.",
              "User can type a task description into the input field.",
              "Pressing 'Enter' or clicking an 'Add' button adds the task to the list.",
              "The input field is cleared after adding a task."
            ]
          },
          {
            "id": "FR-002",
            "description": "Allows a user to mark a task as complete or incomplete.",
            "priority": "high",
            "acceptance_criteria": [
              "A checkbox or similar control is visible next to each task.",
              "Clicking the checkbox toggles the task's completion status.",
              "Completed tasks are visually distinct from pending tasks (e.g., strikethrough text, faded color)."
            ]
          },
          {
            "id": "FR-003",
            "description": "Allows a user to modify the description of an existing task.",
            "priority": "medium",
            "acceptance_criteria": [
              "An 'Edit' button or icon is available for each task.",
              "Clicking 'Edit' allows the user to modify the task's description in-place.",
              "Saving the changes updates the task in the list."
            ]
          },
          {
            "id": "FR-004",
            "description": "Allows a user to remove a task from the list.",
            "priority": "high",
            "acceptance_criteria": [
              "A 'Delete' button or icon is available for each task.",
              "Clicking 'Delete' prompts the user for confirmation.",
              "Upon confirmation, the task is permanently removed from the list."
            ]
          },
          {
            "id": "FR-005",
            "description": "Ensures that the user's tasks are saved between sessions.",
            "priority": "high",
            "acceptance_criteria": [
              "Tasks added, edited, deleted, or marked as complete persist after the browser is closed and reopened.",
              "The application uses browser local storage to save task data."
            ]
          },
          {
            "id": "FR-006",
            "description": "The user interface must be fully responsive and adapt to various device viewports.",
            "priority": "medium",
            "acceptance_criteria": [
              "The application layout adjusts cleanly for mobile, tablet, and desktop screen sizes.",
              "All functionality is accessible and usable on all supported screen sizes."
            ]
          }
        ],
        "non_functional_requirements": [
          {
            "category": "Performance",
            "description": "The web application should load quickly and provide a smooth user experience without noticeable delays in interactions.",
            "metrics": [
              "Initial page load time under 2 seconds.",
              "UI response to user actions (add, complete, delete) under 100ms."
            ]
          },
          {
            "category": "Usability",
            "description": "The interface must be intuitive and easy to use for a general audience with minimal to no instruction.",
            "metrics": [
              "A new user can successfully add and complete a task within 30 seconds.",
              "Controls for adding, editing, and deleting tasks are clearly visible and understandable."
            ]
          },
          {
            "category": "Compatibility",
            "description": "The application must render and function correctly across the latest versions of major web browsers.",
            "metrics": [
              "Full support for the latest two versions of Google Chrome, Mozilla Firefox, Apple Safari, and Microsoft Edge."
            ]
          },
          {
            "category": "Accessibility",
            "description": "The application should be usable by people with disabilities, following web accessibility standards.",
            "metrics": [
              "WCAG 2.1 Level AA compliance.",
              "Full keyboard navigation support.",
              "Screen reader compatibility."
            ]
          }
        ],
        "complexity": "low",
        "estimated_timeline": "20-30 hours",
        "recommended_tech_stack": {
          "backend": [
            "None (for local storage version)",
            "Node.js with Express (for optional database version)"
          ],
          "frontend": [
            "HTML5",
            "CSS3",
            "JavaScript (ES6+)"
          ],
          "database": [
            "Browser Local Storage",
            "PostgreSQL or MongoDB (for optional database version)"
          ],
          "devops": [
            "Git (Version Control)",
            "GitHub Pages or Netlify (for static hosting)"
          ]
        },
        "project_structure": {
          "folders": {
            "src": [
              "index.html",
              "style.css",
              "script.js"
            ],
            "games": [
              "tic-tac-toe.js"
            ],
            "assets": [
              "images/",
              "icons/"
            ]
          }
        },
        "risks": [
          "Data Loss: Since data is stored in local storage, users can lose their data if they clear their browser cache or switch devices.",
          "Scope Creep: Requests for additional features like user accounts, due dates, or categories could expand the project beyond its initial low-complexity scope and timeline.",
          "Browser Inconsistencies: Minor differences in JavaScript or CSS implementation across browsers may require specific fixes."
        ],
        "assumptions": [
          "The initial version will not require user authentication. All data will be stored in the browser's local storage.",
          "The application will manage a single to-do list, not multiple lists per user.",
          "The target users will be using modern, up-to-date web browsers that support HTML5, CSS3, and ES6 JavaScript.",
          "The scope is limited to the core features of a to-do list; advanced features like reminders, attachments, or collaboration are out of scope."
        ]
      },
      "requires_modification": false,
      "modification_comments": []
    },
    "awaiting_review": true,
    "message": "Requirements analysis complete. Awaiting human review.",
    "steps_completed": [
      "requirements"
    ]
  }
}