{
  "project_id": "proj-1763711288",
  "project_name": "knox",
  "requirements": "Basic To-Do List Website named Knox, Requirements\r\nUser Interface:\r\n\r\nSimple input field to add new tasks quickly.\r\n\r\nList display area showing tasks clearly.\r\n\r\nCheckboxes or toggles to mark tasks as completed.\r\n\r\nEdit and delete options for existing tasks.\r\n\r\nResponsive design for use on both desktop and mobile devices.\r\n\r\nTask Management:\r\n\r\nAbility to add, edit, and delete tasks.\r\n\r\nMark tasks as complete or incomplete.\r\n\r\nOption to prioritize or categorize tasks.\r\n\r\nSave tasks persistently (local storage or backend database).\r\n\r\nUser Experience:\r\n\r\nClear visual differentiation between completed and pending tasks.\r\n\r\nEasy navigation and intuitive controls.\r\n\r\nOption to reorder tasks by drag and drop or priority.\r\n\r\nTechnical Requirements:\r\n\r\nResponsive front-end using HTML, CSS, and JavaScript.\r\n\r\nOptional backend for user authentication and task storage (using database).\r\n\r\nCross-browser compatibility.\r\n\r\nPerformance optimized for fast load and smooth interactions.\r\n\r\n",
  "status": "awaiting_review",
  "created_at": "2025-11-21T13:18:08.291687",
  "updated_at": "2025-11-21T13:18:08.291687",
  "steps": [],
  "logs": [
    "LOG:Workflow started",
    "STARTED:requirements",
    "LOG:Running requirements agent...",
    "Starting domain-aware requirements analysis",
    "Classifying project type and domain",
    "No context found for project knox",
    "Creating initial context from requirements",
    "Researching best practices for general domain",
    "Researching: best practices general web_application development",
    "Researching: general software requirements standards",
    "Researching: web_application architecture patterns general",
    "Domain research completed: 0 results found",
    "Generating domain-specific requirements",
    "LLM invocation failed (attempt 1): 429 Resource has been exhausted (e.g. check quota).",
    "LLM invocation failed (attempt 2): 429 Resource has been exhausted (e.g. check quota).",
    "LOG:requirements agent finished successfully.",
    "PAUSED:requirements",
    "Raw LLM response in call_llm (structured): functional_requirements=[FunctionalRequirement(id='FR-1', description='Users can add new tasks to their to-do list.', priority='high', acceptance_criteria=['User can type a task description into an input field.', \"Pressing 'Enter' or clicking an 'Add' button adds the new task to the list.\", 'The input field is cleared after a task is added.']), FunctionalRequirement(id='FR-2', description='Display all current tasks.', priority='high', acceptance_criteria=['All tasks are displayed in a list format.', 'Each task in the list shows its description.', 'Completed tasks are visually distinct from pending tasks (e.g., strikethrough text).']), FunctionalRequirement(id='FR-3', description='Users can mark tasks as complete or incomplete.', priority='high', acceptance_criteria=['Each task has a checkbox or a toggle button.', 'Clicking the checkbox marks the task as complete.', 'Clicking it again marks the task as incomplete.']), FunctionalRequirement(id='FR-4', description='Users can edit the description of an existing task.', priority='medium', acceptance_criteria=[\"Each task has an 'Edit' button.\", \"Clicking 'Edit' makes the task description editable in-place.\", 'Saving the changes updates the task description in the list.']), FunctionalRequirement(id='FR-5', description='Users can delete tasks from the list.', priority='high', acceptance_criteria=[\"Each task has a 'Delete' button.\", \"Clicking 'Delete' prompts the user for confirmation.\", 'Upon confirmation, the task is permanently removed from the list.']), FunctionalRequirement(id='FR-6', description=\"Tasks are saved in the browser's local storage.\", priority='high', acceptance_criteria=['Tasks persist in the browser even after the page is reloaded or the browser is closed.', 'All additions, edits, deletions, and status changes are saved automatically.']), FunctionalRequirement(id='FR-7', description='Allow users to reorder tasks.', priority='low', acceptance_criteria=['Users can drag and drop tasks to change their order in the list.', 'The new order is saved and persists after a page reload.'])] non_functional_requirements=[NonFunctionalRequirement(category='Performance', description='The application should load quickly and respond to user interactions without noticeable delay.', metrics=['Initial page load time < 2 seconds.', 'UI updates (add, delete, check) < 200ms.']), NonFunctionalRequirement(category='Usability', description='The user interface must be intuitive and easy to use for non-technical users.', metrics=['A new user can add and complete a task in under 30 seconds without instructions.', 'All interactive elements have clear visual feedback (e.g., hover states, click effects).']), NonFunctionalRequirement(category='Responsiveness', description='The application layout must adapt to different screen sizes, providing a good user experience on both desktop and mobile devices.', metrics=['The application is fully functional and readable on screen widths from 320px to 1920px.', 'No horizontal scrolling is required on mobile devices.']), NonFunctionalRequirement(category='Compatibility', description='The application must function correctly on the latest versions of major web browsers.', metrics=['Full functionality on the latest two versions of Chrome, Firefox, Safari, and Edge.']), NonFunctionalRequirement(category='Data Integrity', description=\"User's task data should not be lost or corrupted during normal use.\", metrics=['Tasks saved in local storage are correctly retrieved on subsequent visits.'])] complexity='low' estimated_timeline='20-30 hours' recommended_tech_stack=TechnologyStack(backend=['None (Client-side persistence using Local Storage)'], frontend=['React.js (or Vue.js)', 'HTML5', 'CSS3 (or a utility-first framework like Tailwind CSS)'], database=['None (Browser Local Storage)'], devops=['GitHub Pages', 'Netlify', 'Vercel']) project_structure=ProjectStructure(folders={'src': ['index.html', 'style.css', 'script.js'], 'games': ['tic-tac-toe.js'], 'assets': ['images/', 'icons/']}) risks=['Scope Creep: Requests for additional features like user accounts, cloud sync, or due dates could expand the project beyond the initial low-complexity scope.', 'Data Loss: Since data is stored in local storage, users can lose their data if they clear their browser cache. This limitation should be communicated.', 'UI/UX Challenges: Achieving a truly intuitive drag-and-drop and editing experience can be more time-consuming than anticipated.'] assumptions=['The initial version will use browser Local Storage for data persistence, as a backend is optional.', 'User authentication and multi-user support are out of scope for this version.', 'The design will be minimalistic and functional, focusing on core features rather than complex UI/UX elements.', 'Cross-browser compatibility targets the latest versions of major browsers (Chrome, Firefox, Safari, Edge).']",
    "Raw LLM response (structured): functional_requirements=[FunctionalRequirement(id='FR-1', description='Users can add new tasks to their to-do list.', priority='high', acceptance_criteria=['User can type a task description into an input field.', \"Pressing 'Enter' or clicking an 'Add' button adds the new task to the list.\", 'The input field is cleared after a task is added.']), FunctionalRequirement(id='FR-2', description='Display all current tasks.', priority='high', acceptance_criteria=['All tasks are displayed in a list format.', 'Each task in the list shows its description.', 'Completed tasks are visually distinct from pending tasks (e.g., strikethrough text).']), FunctionalRequirement(id='FR-3', description='Users can mark tasks as complete or incomplete.', priority='high', acceptance_criteria=['Each task has a checkbox or a toggle button.', 'Clicking the checkbox marks the task as complete.', 'Clicking it again marks the task as incomplete.']), FunctionalRequirement(id='FR-4', description='Users can edit the description of an existing task.', priority='medium', acceptance_criteria=[\"Each task has an 'Edit' button.\", \"Clicking 'Edit' makes the task description editable in-place.\", 'Saving the changes updates the task description in the list.']), FunctionalRequirement(id='FR-5', description='Users can delete tasks from the list.', priority='high', acceptance_criteria=[\"Each task has a 'Delete' button.\", \"Clicking 'Delete' prompts the user for confirmation.\", 'Upon confirmation, the task is permanently removed from the list.']), FunctionalRequirement(id='FR-6', description=\"Tasks are saved in the browser's local storage.\", priority='high', acceptance_criteria=['Tasks persist in the browser even after the page is reloaded or the browser is closed.', 'All additions, edits, deletions, and status changes are saved automatically.']), FunctionalRequirement(id='FR-7', description='Allow users to reorder tasks.', priority='low', acceptance_criteria=['Users can drag and drop tasks to change their order in the list.', 'The new order is saved and persists after a page reload.'])] non_functional_requirements=[NonFunctionalRequirement(category='Performance', description='The application should load quickly and respond to user interactions without noticeable delay.', metrics=['Initial page load time < 2 seconds.', 'UI updates (add, delete, check) < 200ms.']), NonFunctionalRequirement(category='Usability', description='The user interface must be intuitive and easy to use for non-technical users.', metrics=['A new user can add and complete a task in under 30 seconds without instructions.', 'All interactive elements have clear visual feedback (e.g., hover states, click effects).']), NonFunctionalRequirement(category='Responsiveness', description='The application layout must adapt to different screen sizes, providing a good user experience on both desktop and mobile devices.', metrics=['The application is fully functional and readable on screen widths from 320px to 1920px.', 'No horizontal scrolling is required on mobile devices.']), NonFunctionalRequirement(category='Compatibility', description='The application must function correctly on the latest versions of major web browsers.', metrics=['Full functionality on the latest two versions of Chrome, Firefox, Safari, and Edge.']), NonFunctionalRequirement(category='Data Integrity', description=\"User's task data should not be lost or corrupted during normal use.\", metrics=['Tasks saved in local storage are correctly retrieved on subsequent visits.'])] complexity='low' estimated_timeline='20-30 hours' recommended_tech_stack=TechnologyStack(backend=['None (Client-side persistence using Local Storage)'], frontend=['React.js (or Vue.js)', 'HTML5', 'CSS3 (or a utility-first framework like Tailwind CSS)'], database=['None (Browser Local Storage)'], devops=['GitHub Pages', 'Netlify', 'Vercel']) project_structure=ProjectStructure(folders={'src': ['index.html', 'style.css', 'script.js'], 'games': ['tic-tac-toe.js'], 'assets': ['images/', 'icons/']}) risks=['Scope Creep: Requests for additional features like user accounts, cloud sync, or due dates could expand the project beyond the initial low-complexity scope.', 'Data Loss: Since data is stored in local storage, users can lose their data if they clear their browser cache. This limitation should be communicated.', 'UI/UX Challenges: Achieving a truly intuitive drag-and-drop and editing experience can be more time-consuming than anticipated.'] assumptions=['The initial version will use browser Local Storage for data persistence, as a backend is optional.', 'User authentication and multi-user support are out of scope for this version.', 'The design will be minimalistic and functional, focusing on core features rather than complex UI/UX elements.', 'Cross-browser compatibility targets the latest versions of major browsers (Chrome, Firefox, Safari, Edge).']"
  ],
  "files": [],
  "current_step": null,
  "completed": false,
  "enable_github": false,
  "github_username": "",
  "github_token": "",
  "generate_tests": true,
  "generate_devops": true,
  "last_saved": "2025-11-21T13:40:11.572101+05:30",
  "state": {
    "project_id": "proj-1763711288",
    "project_name": "knox",
    "requirements": "Basic To-Do List Website named Knox, Requirements\r\nUser Interface:\r\n\r\nSimple input field to add new tasks quickly.\r\n\r\nList display area showing tasks clearly.\r\n\r\nCheckboxes or toggles to mark tasks as completed.\r\n\r\nEdit and delete options for existing tasks.\r\n\r\nResponsive design for use on both desktop and mobile devices.\r\n\r\nTask Management:\r\n\r\nAbility to add, edit, and delete tasks.\r\n\r\nMark tasks as complete or incomplete.\r\n\r\nOption to prioritize or categorize tasks.\r\n\r\nSave tasks persistently (local storage or backend database).\r\n\r\nUser Experience:\r\n\r\nClear visual differentiation between completed and pending tasks.\r\n\r\nEasy navigation and intuitive controls.\r\n\r\nOption to reorder tasks by drag and drop or priority.\r\n\r\nTechnical Requirements:\r\n\r\nResponsive front-end using HTML, CSS, and JavaScript.\r\n\r\nOptional backend for user authentication and task storage (using database).\r\n\r\nCross-browser compatibility.\r\n\r\nPerformance optimized for fast load and smooth interactions.\r\n\r\n",
    "status": "awaiting_review",
    "created_at": "2025-11-21T13:18:08.291687",
    "updated_at": "2025-11-21T13:18:08.291687",
    "steps": [],
    "logs": [
      "LOG:Workflow started"
    ],
    "files": [],
    "current_step": "requirements",
    "completed": false,
    "enable_github": false,
    "github_username": "",
    "github_token": "",
    "generate_tests": true,
    "generate_devops": true,
    "last_saved": "2025-11-21T13:36:40.721606+05:30",
    "checkpoint_data": {
      "stage": "requirements",
      "analysis": {
        "functional_requirements": [
          {
            "id": "FR-1",
            "description": "Users can add new tasks to their to-do list.",
            "priority": "high",
            "acceptance_criteria": [
              "User can type a task description into an input field.",
              "Pressing 'Enter' or clicking an 'Add' button adds the new task to the list.",
              "The input field is cleared after a task is added."
            ]
          },
          {
            "id": "FR-2",
            "description": "Display all current tasks.",
            "priority": "high",
            "acceptance_criteria": [
              "All tasks are displayed in a list format.",
              "Each task in the list shows its description.",
              "Completed tasks are visually distinct from pending tasks (e.g., strikethrough text)."
            ]
          },
          {
            "id": "FR-3",
            "description": "Users can mark tasks as complete or incomplete.",
            "priority": "high",
            "acceptance_criteria": [
              "Each task has a checkbox or a toggle button.",
              "Clicking the checkbox marks the task as complete.",
              "Clicking it again marks the task as incomplete."
            ]
          },
          {
            "id": "FR-4",
            "description": "Users can edit the description of an existing task.",
            "priority": "medium",
            "acceptance_criteria": [
              "Each task has an 'Edit' button.",
              "Clicking 'Edit' makes the task description editable in-place.",
              "Saving the changes updates the task description in the list."
            ]
          },
          {
            "id": "FR-5",
            "description": "Users can delete tasks from the list.",
            "priority": "high",
            "acceptance_criteria": [
              "Each task has a 'Delete' button.",
              "Clicking 'Delete' prompts the user for confirmation.",
              "Upon confirmation, the task is permanently removed from the list."
            ]
          },
          {
            "id": "FR-6",
            "description": "Tasks are saved in the browser's local storage.",
            "priority": "high",
            "acceptance_criteria": [
              "Tasks persist in the browser even after the page is reloaded or the browser is closed.",
              "All additions, edits, deletions, and status changes are saved automatically."
            ]
          },
          {
            "id": "FR-7",
            "description": "Allow users to reorder tasks.",
            "priority": "low",
            "acceptance_criteria": [
              "Users can drag and drop tasks to change their order in the list.",
              "The new order is saved and persists after a page reload."
            ]
          }
        ],
        "non_functional_requirements": [
          {
            "category": "Performance",
            "description": "The application should load quickly and respond to user interactions without noticeable delay.",
            "metrics": [
              "Initial page load time < 2 seconds.",
              "UI updates (add, delete, check) < 200ms."
            ]
          },
          {
            "category": "Usability",
            "description": "The user interface must be intuitive and easy to use for non-technical users.",
            "metrics": [
              "A new user can add and complete a task in under 30 seconds without instructions.",
              "All interactive elements have clear visual feedback (e.g., hover states, click effects)."
            ]
          },
          {
            "category": "Responsiveness",
            "description": "The application layout must adapt to different screen sizes, providing a good user experience on both desktop and mobile devices.",
            "metrics": [
              "The application is fully functional and readable on screen widths from 320px to 1920px.",
              "No horizontal scrolling is required on mobile devices."
            ]
          },
          {
            "category": "Compatibility",
            "description": "The application must function correctly on the latest versions of major web browsers.",
            "metrics": [
              "Full functionality on the latest two versions of Chrome, Firefox, Safari, and Edge."
            ]
          },
          {
            "category": "Data Integrity",
            "description": "User's task data should not be lost or corrupted during normal use.",
            "metrics": [
              "Tasks saved in local storage are correctly retrieved on subsequent visits."
            ]
          }
        ],
        "complexity": "low",
        "estimated_timeline": "20-30 hours",
        "recommended_tech_stack": {
          "backend": [
            "None (Client-side persistence using Local Storage)"
          ],
          "frontend": [
            "React.js (or Vue.js)",
            "HTML5",
            "CSS3 (or a utility-first framework like Tailwind CSS)"
          ],
          "database": [
            "None (Browser Local Storage)"
          ],
          "devops": [
            "GitHub Pages",
            "Netlify",
            "Vercel"
          ]
        },
        "project_structure": {
          "folders": {
            "src": [
              "index.html",
              "style.css",
              "script.js"
            ],
            "games": [
              "tic-tac-toe.js"
            ],
            "assets": [
              "images/",
              "icons/"
            ]
          }
        },
        "risks": [
          "Scope Creep: Requests for additional features like user accounts, cloud sync, or due dates could expand the project beyond the initial low-complexity scope.",
          "Data Loss: Since data is stored in local storage, users can lose their data if they clear their browser cache. This limitation should be communicated.",
          "UI/UX Challenges: Achieving a truly intuitive drag-and-drop and editing experience can be more time-consuming than anticipated."
        ],
        "assumptions": [
          "The initial version will use browser Local Storage for data persistence, as a backend is optional.",
          "User authentication and multi-user support are out of scope for this version.",
          "The design will be minimalistic and functional, focusing on core features rather than complex UI/UX elements.",
          "Cross-browser compatibility targets the latest versions of major browsers (Chrome, Firefox, Safari, Edge)."
        ]
      },
      "requires_modification": false,
      "modification_comments": []
    },
    "awaiting_review": true,
    "message": "Requirements analysis complete. Awaiting human review.",
    "steps_completed": [
      "requirements"
    ]
  }
}